{
  "$schema": "https://json-schema.org/draft/2020-12/schema",
  "$id": "https://photo-publisher.org/schemas/project.schema.json",
  "title": "Photo Publisher Project",
  "description": "Configuration contract describing a photo gallery project and its infrastructure.",
  "type": "object",
  "additionalProperties": false,
  "required": [
    "schemaVersion",
    "project",
    "gallery",
    "repository",
    "hosting",
    "storage"
  ],
  "properties": {
    "schemaVersion": {
      "type": "integer",
      "enum": [1, 2]
    },
    "project": {
      "type": "object",
      "additionalProperties": false,
      "required": ["id", "name"],
      "properties": {
        "id": {
          "type": "string",
          "pattern": "^[a-z0-9][a-z0-9-]{1,99}$"
        },
        "name": {
          "type": "string",
          "minLength": 1,
          "maxLength": 200
        },
        "client": {
          "type": "string",
          "maxLength": 200
        },
        "date": {
          "type": "string",
          "format": "date"
        }
      }
    },
    "gallery": {
      "type": "object",
      "additionalProperties": false,
      "required": ["template", "title"],
      "properties": {
        "template": {
          "type": "string",
          "minLength": 1,
          "maxLength": 100
        },
        "title": {
          "type": "string",
          "minLength": 1,
          "maxLength": 200
        },
        "description": {
          "type": "string",
          "maxLength": 5000
        },
        "bundlePath": {
          "type": "string",
          "minLength": 1,
          "maxLength": 2000
        }
      }
    },
    "source": {
      "type": "object",
      "additionalProperties": false,
      "required": ["type"],
      "properties": {
        "type": {
          "type": "string",
          "enum": ["folder"]
        },
        "path": {
          "type": "string",
          "maxLength": 2000
        }
      }
    },
    "repository": {
      "type": "object",
      "additionalProperties": false,
      "required": ["provider", "repository"],
      "properties": {
        "provider": {
          "type": "string",
          "minLength": 1,
          "maxLength": 50
        },
        "repository": {
          "type": "string",
          "minLength": 1,
          "maxLength": 500
        },
        "branch": {
          "type": "string",
          "minLength": 1,
          "maxLength": 200
        }
      }
    },
    "hosting": {
      "type": "object",
      "additionalProperties": false,
      "required": ["provider"],
      "properties": {
        "provider": {
          "type": "string",
          "minLength": 1,
          "maxLength": 50
        },
        "project": {
          "type": "string",
          "maxLength": 500
        },
        "teamId": {
          "type": "string",
          "minLength": 1,
          "maxLength": 500
        }
      }
    },
    "storage": {
      "type": "object",
      "additionalProperties": false,
      "required": ["preview", "highResolution"],
      "properties": {
        "preview": { "$ref": "#/$defs/storageTarget" },
        "highResolution": { "$ref": "#/$defs/storageTarget" }
      }
    },
    "domain": {
      "type": "object",
      "additionalProperties": false,
      "required": ["url"],
      "properties": {
        "url": {
          "type": "string",
          "format": "uri"
        }
      }
    }
  },
  "$defs": {
    "storageTarget": {
      "type": "object",
      "additionalProperties": false,
      "required": ["provider"],
      "properties": {
        "provider": {
          "type": "string",
          "minLength": 1,
          "maxLength": 50
        },
        "bucket": {
          "type": "string",
          "maxLength": 500
        },
        "prefix": {
          "type": "string",
          "maxLength": 1000
        },
        "accountId": {
          "type": "string",
          "minLength": 1,
          "maxLength": 500
        },
        "publicBaseUrl": {
          "type": "string",
          "format": "uri",
          "minLength": 1,
          "maxLength": 2000
        }
      }
    }
  },
  "allOf": [
    {
      "if": {
        "properties": {
          "schemaVersion": { "const": 2 }
        },
        "required": ["schemaVersion"]
      },
      "then": {
        "properties": {
          "gallery": {
            "required": ["bundlePath"]
          },
          "hosting": {
            "required": ["project"]
          },
          "storage": {
            "properties": {
              "preview": {
                "required": ["publicBaseUrl"]
              },
              "highResolution": {
                "required": ["accountId", "bucket", "publicBaseUrl"]
              }
            }
          }
        }
      }
    }
  ]
}
